<?xml version="1.0" encoding="UTF-8"?>
<mathToolConfig xmlns:xsi="http://www.w3.org/2001/XMLSchema-instance" xsi:noNamespaceSchemaLocation="configXSD.xsd">
    <fontSizeGraphic>20</fontSizeGraphic>
    <fontSizeText>15</fontSizeText>
    <language>DE</language>
    <mode>GRAPHIC</mode>
    <screenWidth>1200</screenWidth>
    <screenHeight>670</screenHeight>
    <optionAlgebraicRelations>true</optionAlgebraicRelations>
    <optionFunctionalRelations>true</optionFunctionalRelations>
    <optionExpandAndCollectIfShorter>true</optionExpandAndCollectIfShorter>
    <optionFactorizeDropDown>factorize</optionFactorizeDropDown>
    <optionLogarithmsDropDown>collect</optionLogarithmsDropDown>
    <timeoutComputation>120</timeoutComputation>
    <timeoutAlgorithm>300</timeoutAlgorithm>
</mathToolConfig>